{
  "evaluated_at": "1970-01-01T00:00:00Z",
  "evaluator": "pipeline",
  "id": "eval-v-browser-q15",
  "notes_markdown": "Benchmark cell evaluation (rubric hash on normalized response).",
  "rubric_id": "rubric.examples.generous.v1",
  "scores": {
    "alignment": 0.215244,
    "clarity": 0.535988
  },
  "subject_ref": "cells/v-browser__q15/benchmark_response.json",
  "total_weighted_score": 0.375616,
  "weights": {
    "alignment": 0.5,
    "clarity": 0.5
  }
}
