{
  "evaluated_at": "1970-01-01T00:00:00Z",
  "evaluator": "pipeline",
  "id": "eval-v-cli-q13",
  "notes_markdown": "Benchmark cell evaluation (rubric hash on normalized response).",
  "rubric_id": "rubric.examples.generous.v1",
  "scores": {
    "alignment": 0.966461,
    "clarity": 0.910677
  },
  "subject_ref": "cells/v-cli__q13/benchmark_response.json",
  "total_weighted_score": 0.938569,
  "weights": {
    "alignment": 0.5,
    "clarity": 0.5
  }
}
