{
  "evaluated_at": "1970-01-01T00:00:00Z",
  "evaluator": "pipeline",
  "id": "eval-v-cli-p-browser",
  "notes_markdown": "Benchmark cell evaluation (rubric hash on normalized response).",
  "rubric_id": "rubric.examples.comparison.v1",
  "scores": {
    "brevity": 0.442671,
    "grounding": 0.239651,
    "structure": 0.859244,
    "task_fit": 0.205353
  },
  "subject_ref": "cells/v-cli__p-browser/benchmark_response.json",
  "total_weighted_score": 0.43673,
  "weights": {
    "brevity": 0.25,
    "grounding": 0.25,
    "structure": 0.25,
    "task_fit": 0.25
  }
}
