{
  "evaluated_at": "1970-01-01T00:00:00Z",
  "evaluator": "pipeline",
  "id": "eval-retrieval-basics",
  "notes_markdown": "Deterministic pipeline evaluation (byte-hash scores).",
  "rubric_id": "rubric.wiki.v1",
  "scores": {
    "clarity": 0.246497,
    "traceability": 0.719362
  },
  "subject_ref": "examples/dataset/pages/retrieval-basics.md",
  "total_weighted_score": 0.482929,
  "weights": {
    "clarity": 0.5,
    "traceability": 0.5
  }
}
