{
  "evaluated_at": "1970-01-01T00:00:00Z",
  "evaluator": "pipeline",
  "id": "eval-v-cli-q03",
  "notes_markdown": "Benchmark cell evaluation (rubric hash on normalized response).",
  "rubric_id": "rubric.examples.balanced.v1",
  "scores": {
    "actionability": 0.791338,
    "clarity": 0.023933,
    "traceability": 0.941117
  },
  "subject_ref": "cells/v-cli__q03/benchmark_response.json",
  "total_weighted_score": 0.579847,
  "weights": {
    "actionability": 0.33,
    "clarity": 0.34,
    "traceability": 0.33
  }
}
