{
  "evaluated_at": "1970-01-01T00:00:00Z",
  "evaluator": "pipeline",
  "id": "eval-v-repo-p-matrix",
  "notes_markdown": "Benchmark cell evaluation (rubric hash on normalized response).",
  "rubric_id": "rubric.examples.strict.v1",
  "scores": {
    "clarity": 0.448268,
    "failure_awareness": 0.739581,
    "regression_safety": 0.522031,
    "traceability": 0.949051
  },
  "subject_ref": "cells/v-repo__p-matrix/benchmark_response.json",
  "total_weighted_score": 0.657947,
  "weights": {
    "clarity": 0.2,
    "failure_awareness": 0.3,
    "regression_safety": 0.3,
    "traceability": 0.2
  }
}
