{
  "evaluated_at": "1970-01-01T00:00:00Z",
  "evaluator": "pipeline",
  "id": "eval-v-cli-p-drift",
  "notes_markdown": "Benchmark cell evaluation (rubric hash on normalized response).",
  "rubric_id": "rubric.examples.comparison.v1",
  "scores": {
    "brevity": 0.714903,
    "grounding": 0.843584,
    "structure": 0.321625,
    "task_fit": 0.918292
  },
  "scoring_backend": "deterministic",
  "subject_ref": "cells/v-cli__p-drift/benchmark_response.json",
  "total_weighted_score": 0.699601,
  "weights": {
    "brevity": 0.25,
    "grounding": 0.25,
    "structure": 0.25,
    "task_fit": 0.25
  }
}
