{
  "evaluated_at": "1970-01-01T00:00:00Z",
  "evaluator": "pipeline",
  "id": "eval-v-cli-p-repo",
  "notes_markdown": "Benchmark cell evaluation (rubric hash on normalized response).",
  "rubric_id": "rubric.examples.comparison.v1",
  "scores": {
    "brevity": 0.845853,
    "grounding": 0.663916,
    "structure": 0.706638,
    "task_fit": 0.909043
  },
  "subject_ref": "cells/v-cli__p-repo/benchmark_response.json",
  "total_weighted_score": 0.781362,
  "weights": {
    "brevity": 0.25,
    "grounding": 0.25,
    "structure": 0.25,
    "task_fit": 0.25
  }
}
