{
  "evaluated_at": "1970-01-01T00:00:00Z",
  "evaluator": "pipeline",
  "id": "eval-v-cli-p1",
  "notes_markdown": "Benchmark cell evaluation (rubric hash on normalized response).",
  "rubric_id": "rubric.examples.comparison.v1",
  "scores": {
    "brevity": 0.663193,
    "grounding": 0.839918,
    "structure": 0.397348,
    "task_fit": 0.768644
  },
  "scoring_backend": "deterministic",
  "subject_ref": "cells/v-cli__p1/benchmark_response.json",
  "total_weighted_score": 0.667276,
  "weights": {
    "brevity": 0.25,
    "grounding": 0.25,
    "structure": 0.25,
    "task_fit": 0.25
  }
}
