{
  "evaluated_at": "1970-01-01T00:00:00Z",
  "evaluator": "pipeline",
  "id": "eval-v-cli-p-one",
  "notes_markdown": "Benchmark cell evaluation (rubric hash on normalized response).",
  "rubric_id": "rubric.smoke.v1",
  "scores": {
    "clarity": 0.76638,
    "traceability": 0.921365
  },
  "scoring_backend": "deterministic",
  "subject_ref": "cells/v-cli__p-one/benchmark_response.json",
  "total_weighted_score": 0.843873,
  "weights": {
    "clarity": 0.5,
    "traceability": 0.5
  }
}
