{
  "evaluated_at": "1970-01-01T00:00:00Z",
  "evaluator": "pipeline",
  "id": "eval-v-cli-p-inline",
  "notes_markdown": "Benchmark cell evaluation (rubric hash on normalized response).",
  "rubric_id": "rubric.examples.balanced.v1",
  "scores": {
    "actionability": 0.897055,
    "clarity": 0.310933,
    "traceability": 0.819593
  },
  "subject_ref": "cells/v-cli__p-inline/benchmark_response.json",
  "total_weighted_score": 0.672211,
  "weights": {
    "actionability": 0.33,
    "clarity": 0.34,
    "traceability": 0.33
  }
}
