{
  "evaluated_at": "1970-01-01T00:00:00Z",
  "evaluator": "pipeline",
  "id": "eval-v-cli-p-md",
  "notes_markdown": "Benchmark cell evaluation (rubric hash on normalized response).",
  "rubric_id": "rubric.examples.generous.v1",
  "scores": {
    "alignment": 0.022771,
    "clarity": 0.225366
  },
  "subject_ref": "cells/v-cli__p-md/benchmark_response.json",
  "total_weighted_score": 0.124068,
  "weights": {
    "alignment": 0.5,
    "clarity": 0.5
  }
}
