{
  "evaluated_at": "1970-01-01T00:00:00Z",
  "evaluator": "pipeline",
  "id": "eval-v-cli-p-two",
  "notes_markdown": "Benchmark cell evaluation (rubric hash on normalized response).",
  "rubric_id": "rubric.smoke.v1",
  "scores": {
    "clarity": 0.013483,
    "traceability": 0.199049
  },
  "scoring_backend": "deterministic",
  "subject_ref": "cells/v-cli__p-two/benchmark_response.json",
  "total_weighted_score": 0.106266,
  "weights": {
    "clarity": 0.5,
    "traceability": 0.5
  }
}
