{
  "evaluated_at": "1970-01-01T00:00:00Z",
  "evaluator": "pipeline",
  "id": "eval-v-repo-q05",
  "notes_markdown": "Benchmark cell evaluation (rubric hash on normalized response).",
  "rubric_id": "rubric.examples.balanced.v1",
  "scores": {
    "actionability": 0.67363,
    "clarity": 0.520215,
    "traceability": 0.231011
  },
  "subject_ref": "cells/v-repo__q05/benchmark_response.json",
  "total_weighted_score": 0.475405,
  "weights": {
    "actionability": 0.33,
    "clarity": 0.34,
    "traceability": 0.33
  }
}
