{
  "evaluated_at": "2026-03-09T12:00:00Z",
  "evaluator": "pipeline",
  "id": "eval-w03",
  "notes_markdown": "Fixture regression.",
  "rubric_id": "rubric.examples.comparison.v1",
  "scores": {
    "brevity": 0.70,
    "grounding": 0.70,
    "structure": 0.70,
    "task_fit": 0.70
  },
  "scoring_backend": "deterministic",
  "subject_ref": "cells/v-cli__p-one/benchmark_response.json",
  "total_weighted_score": 0.70,
  "weights": {
    "brevity": 0.25,
    "grounding": 0.25,
    "structure": 0.25,
    "task_fit": 0.25
  },
  "judge_provenance_relpath": null
}
